浙江,原来人死后还要继续干生前的活儿是真的。
江苏,不必对比什么 作为里程碑他已经无敌
浙江,“这是俄罗斯的型号，没有安全保险，只有两个扳机。”
北京,刘德华那条线有点儿意思，为这个系列电影开启了新维度。太长了，删减强制煽情正能量能短30min。
黑龙江,2019年看第一部的时候就想着，回国之后如果能在这样的剧组工作就好了，结果今年就真的在这部的片尾字幕了。🥰与有荣焉。今天很想念组里的朋友们。
江苏,低开高走，前半小时脚趾抓地，刘培强的爱情线真的很尬，那个女性胸部特写后韩朵朵生气，我非常非常厌恶郭帆这种没有任何笑点的恶趣味。图恒宇的线救回来了，华仔真的神。ps朱颜曼滋很适合这种角色，喜欢她的颜。
广东,就这还有人说超过《星际穿越》？
湖南,刘德华那条线，给整个电影情节优化了不止一点儿，尤其是溺水后推开门的那一刻，我瞬间：“这是国产电影能有的剧情吗？”
山东,看到沙溢扮演的师傅喊出五十岁以上的出列时还是忍不住落泪
江苏,"《流浪地球》系列，单枪匹马，把中国的科幻电影提升到世界级水平。
这不是老套的个人英雄主义冒险故事，而是一个宏大的全人类史诗！但是，173分钟的片长，三条缺乏交互的故事线，慢热的节奏，劝退路人的冗长数字生命线，确实是讨好了影迷与科幻迷，可无疑也是提高了对广大路人的门槛。
豆瓣用户狂吹刘德华线，但电影院里刘德华线却让很多观众低头玩手机。
2023年1月22日，刘培强先生，生日快乐！
可能也就世界末日了，房价才会跌。
最后，这不比《阿凡达2》的家庭伦理与美式霸凌好看?"
云南,我的建议是，把网络服务中心迁移到高原上来
浙江,笨笨！！你是军犬！！
浙江,四星半。《流浪地球2》比第一部进步很多，并将国产科幻大片提升到了前所未有的高度。世界观足够硬核，动作场面与特效更加恢弘也更加细致，尤其是对太空电梯的呈现，太惊艳了。剧作上也更扎实了，两次大型危机（太空电梯危机、月球坠落危机）、两种理念冲撞（数字生命计划与移山计划）、两个一体两面的主角……冲突线明晰，人物群像立体。同时，周喆直就是新时代的愚公，难怪这个角色要请李雪健老师来演。影片对愚公移山这样的中国精神有了更加丰富有力的传达，这也是区别于好莱坞大片的根本所在。
四川,野心满满，想讲的东西太多了，叙事节奏反而就出了大问题……整成了编年史
山西,笨笨  你是条军犬！
湖北,急死你急死你！我就要看“人类命运共同体”，我就要看世界人民大团结！我就喜欢看人“吴京PTSD”，我就是喜欢战狼！
北京,感谢罗兰·艾默里奇的好兄弟郭帆为我们奉上的《月球陨落》姊妹篇，请让我代表全人类向剧组致敬，献上比《月球陨落》多一星的敬意 p.s. 真的有人觉得这特效是进步了吗 p.p.s. 现在看完半个小时我已经忘了发生了些啥？
江苏,建议前面一小时一剪没。
浙江,很多人因为电影宣扬的集体主义价值观和共产主义理想而打一星，而我恰恰想因为这点给它满分。
山东,我看有些人说又红又爹，感觉确实有点儿。但是点完头我又想，美国哪部电影不是又“蓝”又“宇宙第一”？
北京,三星半。郭帆拍片的恳切，在场景设计和视效的细腻度上，被展现得淋漓尽致，又一次拉高了中国科幻作品的工业水准。雪健老师依旧老辣，刘德华则收获了近年来最有挑战的角色。可惜的是，这部续作在叙事层面太过松散，刘培强、图恒宇两条主线并行，还要给周喆直超大篇幅，以至于情节取舍变得犹疑不决，这对节奏先行的科幻片来说是大忌。角色的篆刻比重，是该系列在未来第一优先要做的功课。
浙江,故事冗长且稀碎。想讲的太多，一样都没有完全说清楚。我全程给我妈讲解，坐我旁边的也在全程给他妈讲解。其实2044年那段没有塞在这部里的必要。关于生命和文明，现实和虚拟，只有标签和口号，没有智性的讨论。全程就是看一群固执的爹抗拒自然，不被任何人和事说服甚至动摇，强行按自己的意志支配地球和地球上的所有生命，并称之为「勇气」，前脚才感叹「人类把最强的密码用在了互相攻击的武器上」后腿就把人类分成「我们的」和「你们的」一面想当老大「我们比你们其他任何人都要正确伟大光荣，听我们的就对了」一面装和气「我们是为全人类考虑，是在（为我们伟大光荣正确的决策所造成的后果）承担责任，不是想搞强霸」，全片刻意制造的笑点，都没有这种又啥又啥的自我矛盾好笑。
马来西亚,看完了，大年初一就在电影院哭了，那种与天斗与人斗与命运斗只为了未知的未来和理想奋斗的中式硬核浪漫让人心潮澎湃。李雪健那个角色在大会的发言真的超牛，大刘笔下的科幻真是处处有着中国人特有的务实和真诚，好喜欢，这电影真的太特么牛批了！
江苏,没有预期好，就是个纪录片，情节太平淡。最佩服李雪健，屁事都没做，什么情况都不知道，就他信心最足，信念坚定，要真都他来做决定，都得玩完。
山东,宏大又空洞，前卫又土气
山东,"散场
“你睡了吗？”
“我睡了”
“我也睡了”"
陕西,放几年前，我会跟着愤青一起骂，骂故事写的不好，骂节奏，但其实我的阅片量来讲根本不懂这些。无非就是跟风黑，显得自己多专业一样。现在呢？有一部电影3个小时让我不困，让我感慨，让我跟着它的思路去走，还能看到中国电影人走向世界的野心，就已经足够了。
广东,所以为什么图恒宇只惦记他女儿。。那他老婆也是那场车祸一起去世的啊。。啊我真的是，中国女人的一生就只有母亲和妻子的身份了吗。还有韩朵朵作为一个医疗兵，连救治伤员的戏份都没有，那她存在的意义是？只为了突出刘培强是个可以保护老婆的好丈夫？
北京,比第一部的视野磅礴，有更加深入的思考，尤其是刘德华的那条数字生命计划线，也是为第三部埋下的彩蛋。特别不喜欢李雪健最后点火时的迷之自信和沙溢的50岁以上出列，充斥着强烈的自我感动和群体绑架。最喜欢的人物是宁理的马兆，代表理性之光，只有在他那里，人类存在的意义和人类之于万物的地位才是最理性的。
北京,纯直男视角，无趣级了。女性是妻子是母亲是女儿，但不是战友。女性发言人角色连群像塑造都不算，顶多是个符号，女性宇航员是背景，韩朵朵本以为有更大的功能，结果后面只是结婚生了个孩子。
北京,像一个理科男疯狂跟我炫他的物理知识 但我不觉得他很牛逼
安徽,当年看完第一部还是蛮喜欢的，觉得它试图在人类的有限里去探索一种无限，尽管这有很大的自我感动的嫌疑。但是这一部看完，不适的观感进一步加重了，尽可能放大所谓人类的情感联结，但是全片看下来超级累，满脑子蹦出来的都是四个字：大而“无用”。大之一，在于肿大，叙事上感觉特别冗余累赘，三条线串联得很笨，松散且有点重复。大之二，在于自大，甚至于接近膨胀的各种主义情绪滋生，这点就不展开说了。大之三，在于夸大，夸大的美学和场景设定，左淹自由女神像右爆悉尼歌剧院，东方明珠只露了个塔尖，鸟巢已经沉入海底了，大裤衩却只淹到脚底，当然这也并不影响啥，但就是觉得，没啥必要。而且，对所有一见面就揶揄女性自以为好笑的直男台词感到反感。工业层面看自然是无懈可击的，第一步也已经迈出去了，但总归是觉得，好像有点使劲错了方向。
浙江,特效五星，创意五星，但是作为女性，我给它扣两星。图恒宇开车转头导致妻女车祸身亡，他却只对女儿思念愧疚追忆，妻子仿佛就是生育工具，此后只字未提，为了女儿还多次置拯救人类大事业于旁，强行凹父爱人设讨人嫌。韩朵朵作为本片中一开始与刘培强两人强强组合的女性角色，最后也安排了一个相夫教子，得病去世的结局，沦为体现刘培强铁汉柔情好丈夫好爸爸人设和走上英雄之路上的重要工具人。还有多次巧合的卡时间成功发射和成功启动来制造紧张感，让人略感不适，巧合多了反而弄巧成拙。
河南,你看流浪2买一张票就能看到《2001太空漫游》，《源代码》，《银翼杀手》，《星际穿越》，甚至还能看到吴京强加了一段太空版《男儿本色》。这么一看还挺值的。只是你得忍受巨慢的三个半小时，以及动不动就硬来的煽情和文化自恋。流浪1凭借文化自恋式的宣发搔到了那些自诩“站起来了”的人的痒处，票房赚麻了；导演尝到甜头，流浪2干脆就用上了痒痒挠，特别是那个年轻的女发言人对着暴跳的美方代表轻蔑的一笑说，我们只是告知不是征得你方同意。这时候电影院里如果不欢呼起立，爆发雷鸣般的掌声，那简直就是观众们不懂风情。
山东,进步不应仅局限于特效，还包括如何看待女性，价值观突破和技术飞跃一样重要，真正大片是两条腿走路。
安徽,真难看，浪费我电影票钱，唯一一部电影院看睡着的电影
辽宁,三星以下对电影不公平，三星以上对观众不公平。
新疆,四星+一星鼓励，值得八分以上的佳作！还有我不理解 看了会睡觉一般是不感兴趣 看了骂依托答辩的都是什么脑回路。美国拍科幻片就能泛滥煽情主旋律，中国就不能是吧。美国就能输出，中国就不能是吧。再说了，我是真没看出来有多主旋律了，要硬说是主旋律的话我认为是人类命运共同体。《星际穿越》可以有亲情，生孩子没问题，到《流浪地球》这就催婚催生了是吧?《星际穿越》里美国人可以拯救全人类，《流浪地球》里中国人就不能拯救世界了是吧?《星际穿越》里可以抛弃一大部分人类，然后一小部分人类放弃地球和太阳系去新星球生存，《流浪地球》就不能有家国情怀，带着剩余一半的人类和地球去寻找新家园是吧?我只能说戴有色眼镜去看总能在鸡蛋里挑出来骨头。当然，上述这些是我好兄弟宸老师（豆瓣可以搜到）以及我亲身经历而有的输出。
天津,比第1部好看。中国科幻电影需要更多的小破球
湖北,"75分。
特效顶级，但是但凡多花1000万在编剧上，故事也不至于碎成这样。这剧本我真的敢说“我行我上”，方方正正，刚直不阿，一块是一块，互相都不粘连。跟旅行vlog一样，你看这里是太空电梯，你看这里是刘培强结婚，你看这里是月球危机，你看这是我们的互联网基地……每个感动的点我都知道导演要感动，但我始终入不了戏，不敢动。隔壁《满江红》有个热评，说“感动你的不是电影，而是满江红这首词”，《球2》也可以套用这个评论：“感动你的不是电影，而是中国的伟大崛起”。"
河北,不要破坏太空电梯！我以后要坐的！
北京,绝对是亚洲科幻大片第一档，但娱乐性上跟好莱坞还是有差距。虽然这些年好莱坞的大片难看在故事越讲越小，任你宇宙爆炸也是拍家人和解，但这部又过于宏大叙事，情感上动人的点太少了
广东,豆瓣已经不是以前那个豆瓣了，电影真的非常一般。
中国台湾,我非常讨厌《流浪地球》系列的科幻世界观，第一部炸木星，第二部炸月球，敢情流浪地球所到之处无一幸免。就算把银河系炸一圈，人类活下来，人类就伟大了吗？人类总是把自己看得太重要，把世界看得太渺小。我喜欢对自然、对未知充满敬畏的科幻片，而不是满满的傲慢。
上海,"感受到主创是如何用心用力地在努力凹成太空史诗的样子（大场面还不少），事实上无论从哪方面看都的确具有视效大片的风范，然而工业指标的进步和原著在硬科幻指数上的抗打，并不能保证一部电影的可看度——打鸡血式的价值观输出和强行灌“责任”，以及过度强调家庭的重要性，其实也是一种美式变体的舶来品（虽说也看得心累，倒也并非最大槽点）。

最难熬的不是“负责任”的假大空口号，难熬的是最后一分钟营救与煽情戏的对冲，直接稀释高潮点的爆发，原文本的庞杂体量和更多冲突原本也可以被匀到更多戏份、处理得更明晰，当然也能理解编导考虑到市场接受度做的处理，毕竟现在的成品看来已够像一篇说明论文了。

1的剪辑问题还在，两条线捏合度也不够，因而三小时经常体感混乱；结尾埋第三季的线太像hal9000了吧。"
重庆,这种“科幻大片”让人失望的地方在于，它们看似有着充沛甚至豪迈的想象力，内核却永远是保守陈旧毫无创造力的旧世界。
辽宁,照古人的月亮将要毁灭今人，进化后的系统阻挡人类存续。人类制造复杂的密码用于相互毁灭，也诞生伟大的文明用于股骨愈合。宇宙里的小小白点是我们的一切，移山让人类的未来有了方向，科技却让数字的生命成为了可能。我们要活在电缆里荧屏中让意识自主永恒，还是心怀蓝天让躯体等到鲜花挂满枝头的瞬间。
北京,刚看完，特效国产最顶，故事情节也好，演员全部演的好
广东,刘德华那条线简直要哭瞎，他现在演技炉火纯青到可以控制微表情和细微动作，在工作人员让他写遗嘱他淡淡地说“我不知道要写给谁”，还有14年没见女儿然后再次见到的那幕，以及死后在数据里与女儿重逢，害我“哇”一下哭到坐我旁边的人直接吓到；宁理老师也是，明知道他要死，还是忍不住会哭，出了影院眼睛都肿了，气到我直骂我兄弟哪有人选大年初一来看煽情片的；如果可以剪掉煽情点和主旋律和正能量，这部片的科幻概念与视觉呈现是超乎意料的；但是也只有中国导演才懂“思乡”“回家”对中国人的意义如此重大，吴京老婆患癌说着要回上海，他载她飞回一片废墟的上海，那个场景真是无尽的悲凉，我心里响起了一句话：“我们没有家了。”人的智慧在科学，而人的灵魂在情感，这部片很好地结合了理性和感性，太棒了（就是求别太煽情）。
上海,去掉煽情部分可食用，不过要我说你们人类差不多得了，又不是什么了不起的文明非得要延续下去
陕西,"阿喀琉斯不过是为了自己的友伴帕特罗克罗斯而选择去死，执行机械起爆的老飞行员们却是为了整个人类而选择去死，并把生的希望留给下一代。这种对not to be的讲法不存在于西方传统里，是中国与刘慈欣的的大义。然而还是要借用一句荷马史诗来描绘刘培强与他师傅、上一辈与下一辈的命运传承——人类如落叶，一代代凋零，一代代繁荣。
第一幕太空电梯戏特效拉了，之后的月球戏特效真的好，身临其境。第一幕之后虽然整体结构上还是传统三幕式电影，但叙事的跳跃有了原著里的那种编年史的壮阔感。
李雪健老师的表演太好，中山装太帅
刘德华对他的角色在表演方面无可挑剔，但从剧作方面来讲，这个角色，不同于刘培强因为前作的设定只能是男性，可以写成女性角色，交给女性去演。单一的男性视角是刘慈欣作品的唯一缺陷。"
广东,刘德华的角色充分验证了行车不规范亲人两行泪的大道理
上海,1还只是部传统好莱坞叙事的电影，这一部才真正找到了自己的声音。虽然有很多显而易见的缺点（比如详细讲述两大独立危机带来的冗长，亲中与反中外国人的刻板刻画，未来世界女性在重要领域仍只是点缀等），但整体超出预期。视觉效果已经不输于好莱坞，故事内核也很动人以及体现着中国价值观。父女情爱情师徒情等线的处理都蛮细腻动人。喜欢那句台词：团结是需要付出代价的。ps：吴孟达出现的第一幕真催人泪下，和电影中数字生命的议题相呼应更让人唏嘘。
辽宁,最后把地球推出了太阳系，看到一个网友的留言有点逗，他说看这个剧感受到了中国人对不动产的执念。
美国,很多废戏，各地人民reaction切换了多次，一些讨巧的幽默很难笑，整体像有个机械的公式在反复硬套。雪健老师的政治博弈写得过于生硬板正，意识形态能塞，但如何巧妙地塞还需修炼；吴京的追妻油腻老套，师徒情凑合；德华兄出彩，情节最贴科幻，感情戏不错。全片女性分量少得可怜，视效虽震撼，但文戏的进步空间还有很多，下一部添点真•科幻吧
湖南,我不喜欢“一定” 没什么是一定会做到的
安徽,仿佛被绑在过年的饭桌上，喂了满嘴仁义道德…………
广东,音乐好好，特效有些地方好，有些地方好粗糙。“我们的人一定行”的类型以后别再拍了，太尬了。
广东,为特效打4星。剧情要吐槽的地方太多了，各种不合逻辑的强行煽情……什么叫“我的人一定能行”，人家生命条都红了，人都死了，你相信的点在哪？
美国,异国他乡看的电影 结束后整个IMAX的人都在鼓掌 中国牛逼！！！
上海,特效无敌！是真正意义上有中国价值观的国际大片。三个小时的观影时间完全饱满，故事讲的非常紧凑且清晰。最后夸下沙溢哥，做到了拥有好演技，录再多综艺也不让人出戏。
河北,"9/10，四星半
没想到在《流浪地球》上映后喊了那么久的“中国科幻电影崛起”之后又一部能拿出手的硬科幻是《流浪地球2》
这一部作为第一部的前传不仅丰富了世界观与第一部有非常多的互文，野心非常大，已经不仅仅局限在“流浪地球”本身了，为后面的续集埋了很大的伏笔。如果是第一部的成功可以说是有巧合运气成分，那这一部郭帆真的是将自己的功力都发挥出来了，各个层面都展现了非常成熟的掌控力，绝对是中国未来最可以期待的商业电影导演。李雪健老师的角色基本没有什么动作，因为一直坐在轮椅上，但是他真的是一个用表情和台词就能完美塑造角色的演员，有几场戏穿透力太强
缺点的话可能就是太强调，试图融入春节档而加入了很多生硬的笑点，最后煽情部分有点太多了拖节奏了，总体上瑕不掩瑜毕竟是真的硬
整体跟第一部相比算得上是进化了"
上海,【IMAX版早场归来】尽管未提出或呈现全新的科幻概念/图景，但各方面比起第一部都有不小的进步与升级，观感上佳。形式与结构上，视觉特效与服化道细节的精湛用心肉眼可见，几位老戏骨都发挥出演技，剪辑不再有前作中混乱潦草的问题，三线交织的结构（分别从航天员/军人、量子计算机技术人员及外交代表/决策者的角度切入）也让叙事体量足够丰富，个人不赞同关于本片节奏慢（与“慢电影”比小巫见大巫）或文本过载（实而不烧脑且略直白，另还有平民生存与联合政府施政方式这两个层面未铺展描摹）的说法。文本深层方面，延拓并融贯了理性（数字生命，或服从/牺牲，虚拟空间，超感性彼岸世界）vs.感性（有情肉身，自保/私欲，地球空间，现世凡尘）的二项对立式。最终，要的是共存互补的人[性]，所以看似破坏的儿女私情实则成为拯救的关键一环。（8.5/10）
安徽,这部前传故事的续集电影，可不止比一好一点，完全是巨大的跨越式进步，真的是百尺竿头更进一步。从0到1很难，难在战胜怀疑从无到有开创新路；而从1到2的难在于如何给出更多的惊喜和提高标准。这次电影给出的都不止惊喜，而是震惊了！方方面面的巨大提升，以及背后巨大的工作量和所需要挑战的事物，令人肃然起敬。加油吧！期待3！
广东,我提出拯救中国科幻计划，让郭帆拍三体
北京,郭帆应该少看《2001太空漫游》，多看几遍《楢山节考》。
重庆,学学减法吧……这大炖锅。电影是煲汤不是冒菜。
广东,忘了在哪里看到的评论：中国男人味溢出宇宙。
上海,"年初一一口气看5部之第5部。

单日电影马拉松的最后一部，为了最好的激光IMAX版本，看完都已经夜里凌晨3点了，回家吃夜宵加整理材料后天都快亮了，意味着我为了看电影几乎24小时没合眼，这属于折寿式观影，请勿模仿。

虽然《流浪地球》几乎是中国科幻电影的独苗，但是好在它的生长确实茁壮，几乎以一己之力把中国科幻片的水平拉到世界级的比较水准，也就更显宝贵。通过幕后纪录片以及实际观影的体验来看，主创团队的确为了构建这个新世界耗费了巨大心血，也看得出来郭帆他们的确是在认真创作，诚恳地征求并遵循科学家们的建议。

太空电梯的长镜头实在太过震撼，战斗机与无人机的空战又实在酣畅，数字生命计划的讨论极富哲学价值。当然最触动人心的还是宏大叙事下本土化的精神表达，虽然很多人反感宏大叙事，可这才是真正天问式地思考人类命运的主题。"
北京,可是，过去这几年的经验告诉我们，大灾当前，人类非但不会更团结，还增强了彼此毁灭的能力。
北京,技术上非常硬核，既是前传也是对1和世界观的合理补充，终于理解了科幻不是科学，但它们是可以紧密结合的。主题上仍发挥着 “人类命运共同体”的概念，却不再是正义为先、昂扬向上的基调，变得凸显日常但同样宏大。没有中间角色，因为三条线的主角或双主角都是均匀的，每个人都有自己的故事跟命运。喜欢图恒宇和马兆那条线，对“数字生命”的解释做得很通俗，呈现的是情感、精神上的选择与对峙。电影最后还是落到情感、落到人，将中国式家国情怀一并包裹进“中国故事”的表达中。
英国,我可真讨厌这冗长又稀碎的故事线连讲个故事都不会了吗 好好的故事讲的稀烂看得我真累 开头胸部特写就很恶心 吴京看见美女也就只会想着结婚 全片都是雄性的天下 女人只会念演讲稿或者得病死掉 一如既往的故弄玄虚装腔作势只会用大字报倒计时推动剧情吗 导演应该是默认了他的观众都是三体迷或者理工科学士学位 不然怎么敢这么多科学概念强行灌入 但也真的不能推敲剧情和科学设定 仔细一琢磨就漏洞百出 很多剧情和人物设计都很牵强 搞不懂这个角色有啥用 然后“外国人都是暴躁无能只会喊妈妈救命我想回家的二傻子而我china最牛你们都得听我的跟我汇报工作”以及外交敌友现状也太明显了吧 这毕竟是影视作品不是政治外交宣传片啊/ 骂完了 精致的烂片 但是给四星 因为我的祖国终于也能拍出星际特效科幻大片了！
上海,高于预期。但周老师全场败笔，除了会说“务必要”、“我相信”、“请相信”、“一会定”之外，没有任何实际作用。
江苏,在一众集体主义轰炸中，刘德华那条线便显得尤为珍贵
广东,好一场灾难，我说的是这个电影。
美国,沙溢堪称全场最佳！回归到片子本身，内核太庞杂了，三小时的时长都险些兜不住这过剩的文本素材——每条线拿出来都能是能单独拍几集电视剧的那种，这就让170多分钟的观影体验显得极其漫长，每当以为“这已经要结束了吧”然后导演又自信地甩出更多不加节制的奇观和煽情，关键问题就在于AI线和人类自救线之间几乎没有什么情绪积累与连接，最后一分钟营救让故事线汇集之时只剩拖时间之嫌、远远达不到一气呵成的舒缓感。但每个桥段又因为卡司的出色演出和优秀的工业水准而十足出挑，就像一顿必然吃不完的自助餐，玲琅满目得过了头，其中的矛盾代表就是刘德华领衔的人工智能线，让人时刻迷失于郭帆和大刘对人类命运的态度之中，到底该是悲观还是希望？恐怕郭帆到剪辑完成那一刻都未曾有过定数，但宏大叙事的基底已经定好，且看第三部会怎么圆吧。
湖南,我个人不允许这片子评分比阿凡达2低。
