湖北,结尾那句：快醒醒 别睡了 很符合我的心情
云南,四星半。不喜欢《大圣归来》的卖情怀，所以对田晓鹏出品是有担心的，但看完后完全超出预期！粒子效果彩色光影美到窒息！之前看预告片感觉是一个小女孩寻回真我的故事，前半段也让人直接联想到《千与千寻》。但完全没想到包裹在这么一个奇幻子供向表皮下的，是黏腻恶心时不时惊吓的掉san恶趣味、致敬了周星驰与黄子华的男主南河人设、心理学精神分析式的内核、细腻的内心世界具象化呈现、以及最重要的极为温柔悲悯的人文关怀落脚点。看前半段时我就猜测到最后会有这么一个反转的“底”，但我想的多半是南柯一梦或者死前走马灯，完全没想到最终落脚点会在关注重男轻女、关注儿童心理、关注抑郁症上。黑色“海精灵”是母亲与南河最后的背影，是风雨中的乱发，看似恐怖实则温暖悲伤。红色“丧气鬼”是母亲最后留下的红外套，是过去的纠缠牢笼。
湖南,这是磕了多少啊我的天（男主做太难看了，票房不好感觉要背一半锅
福建,知道花了很多心思在画面设计上，下次请个好编剧吧。
湖南,这种动画对于目前的中国来说还是太超前了
山东,画面越美越觉得可惜，为什么国漫十几年如一日没有想象力，纯靠煽情和自我感动呢？中国文化可以借鉴的东西这么多，离了宫崎骏就不行了是吗？（中间有一段故事稀碎的让人如坐针毡，男女角色之间各说各话，毫无逻辑可言，男主性格时而疯癫时而颓丧，形象割裂到让人无法忍受，群众的行为也莫名其妙，人设一个也没立起来）我愿意花钱支持国漫，请国漫不要负我。
浙江,什么玩意儿，堪称诈骗。前面模仿千与千寻，后面在想这不会是少年Pi吧？故事都讲不好就别搞特效了吧，特效应该是为故事服务，而不是炫技。
四川,这融梗融得…千与千寻、少年派的奇幻漂亮、功夫（南河不就是动画版周星驰的形象吗？）、哈尔的移动城堡…最后呼吁一下：请个别家长管好自己孩子，别牺牲路人的生命！
辽宁,前面看得满头问号，只能说有些画面很精美有些太杂乱甚至有点恶心…看到后半部分才恍然大悟，尤其是结尾部分，才发现前面好多细节值得细品，这个故事其实也是很丰满的。前面总觉得南河太丑，为什么一个救赎他人的人不可以更好看一点呢，也许是一个对比吧，南河的形象是小丑的形象，落魄的形象，但他用生命救赎了参宿，自己还在淋着雨却不顾一切为别人撑伞。我开始理解，前面那些或绚丽夺目或心惊肉跳的画面就是一个人的内心，幻想被爱的时刻，恐惧害怕的时刻，那些纷繁杂乱，无人知晓。观影时看到一个弹幕说这个小女孩还真是不讨喜，我真的很反感，为什么要讨人喜欢，你以为你是谁？小参宿，希望你今后的每一次笑，都是真心的。
上海,春节档的几部电影里，最期待的便是深海。为此还收了一本《深海大饭店》画册，对那艘机械鲸鱼的“深海号”赞不绝口。看完电影才发现，原来这是一个如此美丽又如此悲伤的故事，就像那个吊儿郎当的小丑南河，他不过是一个落魄的尼摩船长。而华丽的深海号，也只是一艘悲梦的鹦鹉螺号。但即便如此，电影仍呈现出吞噬天地般的视觉效果，而其中蕴含着的情感，又像这场梦境那般永无尽头。潜入深海，就像潜入意识深处，那里有一个孤独的孩子，永远无法诉说的广袤宇宙。它像恒星一样遥不可及，又像玩具一样视而不见。你把它轻轻切开，就会发现里面装满了破碎之心。
浙江,与其撕贺岁档谁是票房第一，不如肯定认真做动画电影这些人的热爱和努力，即便是借来的故事框架，过多的致敬，不算太好的故事节奏和台词，但中国动画电影在1到100这件事上做的足够出色了
广东,纵然在情节安排有令人不适的地方，但此片也是近年最优秀的电影，不仅于动画片，真诚的作品是能打动观众的，国产最高的画面技术，独有的粒子水墨，梦与现实的故事其实并不简单，也没有做到晦涩，全片的情感氛围烘托，这一切无意营造出独特气质。这是一部真正的艺术片啊，影评人所求的大师手法感动他们，不就在这吗？（另外，现在观众却依然对动画电影有偏见，以及他们的审美如此狭隘短浅
浙江,《深海》是一部关于孤独的电影，在春节档影院合家欢的氛围中，在邻座大声讨论剧情的调侃中，在后座大声咀嚼爆米花的声音中，这种孤独感被无限地放大了...
湖南,真的好爱，爆哭三次，哭到服务员问我没事吧，国漫终于不再局限于神话故事，开始探寻存在与意识，探寻哲学的深海，即使有的人永远只能看见性别，但弗洛伊德关爱每一个自我。
江苏,不喜欢审丑和审胖，前大半段的剧情完全是重复的，真的无聊，最后的解释显得非常苍白。找妈妈干什么呢，去找一个完全不把你放在心上的人…根本立不住…完全是导演的自我感动吧…看个电影就为了最后十来分钟的话我觉得根本没有看电影的必要了…有个无端联想：丧气鬼/晦气/红色的液体-月经/初潮
山东,这个分数真的低了！！！只能说不是人人都适合看深海，也不是人人能够看懂深海，但喜欢的就会特别喜欢，一个人去电影院看，去感受，真的真的很沉浸！就是结局不喜欢😭但，真诚就是必杀技！
河南,我称之为意识流动画，全程肆意狂想，喷薄而出的想象力创作力，如果梵高在当代也会这样画星空麦田。最后的着力点打破了第四面墙，处理的方式太让我感动了。满分。
安徽,《深海》是另类的，它没有家国情怀下的一腔热血，没有宏观宇宙里的人类命运，它关注的只是普通个体身上微不足道的情绪波动。原生家庭痛苦阴影环绕着的少女，为了攒钱还贷款的小丑，底层的抱团取暖，他们抛却所有的社会身份而回归个体更私人的情感，在这场梦幻的深海之旅里撕破伤口，不断的内耗和挣扎中试图让自己好过，以付出生命的代价换取勇敢和信心的自愈。但醒醒吧，该散场了，敲碎这一场美梦，你看到的所有一切都是假象，根本没有结局，真实的世界远比此更加黑暗。
浙江,哭得惊天动地天崩地裂
广东,"我从未想过能够在国内大荧幕上看到这样情感充沛的电影。人心人心，深海深海，最难触及，也最为柔软。后半段堪称大部分东亚女成长历程的闪回。
Ps.其实从电影手法上来看，深海走的是先抑后扬，逐渐高潮的方式，所以并不新鲜，同样，缺乏铺垫的人物羁绊也让人觉得可惜。但是能在当下这个早已将个人负面情绪当做洪水猛兽的社会，看到这样一部直抒抑郁情绪的电影，实在是出乎我的意料。光是主角是两个小人物，主题也不再是重复讲述梦想这一点，就足够让我感到难得了。毕竟当前大环境下遍地宏大叙事，而关注个人内心成长的电影实在凤毛麟角。所以从这个角度来看，我愿意给深海5星。"
上海,画面极其绚丽，甚至到了过犹不及的程度，对于癫痫症患者很致命。湿哒哒，究极杂乱画面不是很对我胃口，但是得说细节和技术确实很厉害，属于是钱多得没处花了。全篇克苏鲁味太重，眼球章鱼不知道对小孩来说是否会有心理阴影。结局依我看醒来后的那些场景估计是糊弄审核的，“卖火柴的小女孩”才是真正的结局。
四川,很明显是画师思维导向的电影，具体表现如下，顺便把我的感想一起写了1.平均5分钟一个很炫很酷的长镜头2.段落分明衔接不够顺畅感觉像是一个个短片拼起来的，观众的情绪跟不上逻辑跟不上看得我疑问越看越多但是剧情完全顾左右而言他我只能完全放弃思考只能被动接受 3.演出过度、配乐过度镜头完全成为了炫技的工具而不是叙事工具4. 剧本纵深感差，转折生硬前中期信息量过少且缺少明确简单的小目标导致观众很容易失焦，而且我真的很讨厌前中期完全一团迷雾只能被动地接受故事走向 5.台词没有水准过于直给 6.画面和镜头喧宾夺主几乎把“我在营造气氛”写在脸上 7.聒噪 8.海鲜让我有点反胃了
北京,用心做画面，用脚找妈妈
浙江,导演喝多了吗，里面人物都像喝了酒似的，乱七八糟的扭来扭去讲台词。专门找了个新开的imax，结果画面全是小景别浅景深，还晃来晃去，你要这样编排镜头，那就别用3D好嘛。真的那么喜欢3D，你就用高亮度高帧率做，我谢谢你了。里面那么多黏糊糊、舔痰盂、火锅煮鞋子、泡面撒的到处都是的设计，除了让人感觉生理不适，对剧情对人设有什么推进作用吗？
湖北,好硬的煽情啊，给我看困了。如果说一开始还有点被推着共情的挣扎感，到后面就完全是厌烦和麻木了。男味儿自我感动味儿贼冲，只不过这回没了大圣的形象加成，感人效果有限。画面还是可以的，只不过有一部分既视感特别强。小女孩儿的面部表情做得挺好。
北京,整个观影过程就是几乎把2022一整年的眼泪流完，如梦如幻的想象力和视觉技术上的确登峰造极，更难得是整部电影的审美有一种超然的高级，这和其他过度饱和的国产动画非常不同，情绪氛围感让我想到看《水形物语》的感受。不过，梦可以醒来，但也不是每一个梦非要醒来，也可以一直留在梦里，活在自己构建的世界里～
安徽,毫无逻辑的剧情走向和人物瞬息万变的丑脸都让人不得不怀疑导演创作时的精神状态🙃中间那段在梵高的星空下花式打拳的画面更是把整片的荒谬程度推向了一个新高潮 笑得俩人一度直不起腰来🤭所谓反转也是意料之中毫无新意 对于无良商贩到鸡汤大师以及抑郁厌世到阖家欢乐的生硬突变只想说呵呵我不信😧从大圣到深海真真是团队审美和叙事能力的断崖式下跌🤨
重庆,这部电影的受众就是我，中间虽然猜到了可能的发展，但真的展现给你的时候还是能让人哭到抽搐，一时半会儿根本缓不过来
上海,很久没看过这么难看的动画大荧幕了…建议被市场淘汰
河南,希望我在崩溃边缘也能有人来救我
上海,"1.28，旅途中抽了一个晚上特意去看。朋友说她看完爆哭，我还特意多带了两包纸巾，结果中途一度昏昏欲睡。特效确实美，但给的太多太满，很快审美疲劳。
总体来说，这个题材导演并没有能把握住。虽然表面看起来故事似乎圆上了，但是非常勉强和浅显。许多人都在说，没有这种经历的人是看不懂这个故事的，然而我这个深刻经历过这种时刻的人看完以后，甚至感受到了一点伤害。肤浅的关心和理解，让整部片子在情节设定上呈现出一种天然的凝视感，表达他们自以为是的痛苦，用他们自以为是的方式和解。他们知道故事的表象，但却从未把其中的逻辑梳理清楚，这也直接导致它的“排外”。
总之，我觉得我们的经历被轻视了，那些痛苦明明很重，明明值得被更好得表达。"
江苏,❶鸡零狗碎；❷叙事效率低下，尤其是深海大饭店登场的部分；❸设定不明；❹结尾强行煽情。
湖南,"一星给美术，制作团队给美工磕一个吧！真的烂，太烂了！！剧情简直依托答辩！感觉是导演想到什么做什么一样，女主爸妈为啥离婚？开头女主妈妈为什么对女主那么冷淡，但是结局还哭喊着要女主回来现实？南河为什么前期那么贪财？后续有为什么不贪财了？整个剧情都完完全全是脱轨的，一点起承转合都没有，不要和我说细节伏笔要重刷，就依托答辩我看一遍还不够吗？他这个剧情根本就是垃圾到恶心我完全不想再看第二眼，纯粹是浪费我的时间。还有关于抑郁的问题，球球高抬贵手放过抑郁症吧。我抑郁想死，正解脱的时候，来个陌生人为了救我死掉，我活了，那我更会再去自杀。
以后审问犯人就放这个吧，他们一定都会招的，什么都会招了。男主建模丑死了，我还以为我是看的恐怖片呢，五官乱飞，还有嗦鞋带yue，恶趣味吐了。"
上海,最有意思的就是 电影院里有几个小孩子看到一半被吓哭了 整个电影除了预告片就能看到的浓郁色彩背景画面不错之外 其他时间画面都很油腻 拥挤 色彩过于丰富 就像冰糖雪梨 一个梨配了10斤糖那么难受 至于剧情 抑郁症和不是抑郁症的看完都沉默了
上海,3D景深、长镜头、水渍…亮点星罗棋布。充盈拍案叫绝视效奇观，千姿百态动画上风淋漓迸现。是出类拔萃美术片，也是杯盘狼藉故事片。只会喊妈妈的“千寻”× 配音不对口型的“大圣”，国漫近来批量生产同款老少配。叙事一片混沌，角色情感互际完全立不住，甚不如《姜子牙》。靠曲终真相强行拔高，类似《少年派》。但李安重视效辅佐剧情，而本作叙事全让位于画面，只落得头晕目眩视觉轰炸。网络热梗也叫人生厌。
上海,前半部分过于令人不适，无论是人物的压抑，还是画面里出现过多的粘液….  餐厅那段戏有点反胃
云南,初时，兴致寥寥，这是千寻、波妞、哈尔、幽灵公主…的变种结合吗？饱和度极高的颜色初看很美很亮眼但容易视觉疲劳。可就在进入中段的一瞬间，像被闪电击中般，突然明白这个故事要表达什么，它隐藏得太深了，恐怕除了真正的抑郁症患者，一部分人要到影片的四分之三处才能明白一二。那大团大团的浓稠色彩和黏腻物像都有了豁然之感，现实与幻境的交叠，戳中了心巴，戳开了泪腺。可是呀，导演呐，如此真挚动人的立意，如此漂亮精致的画面，为什么不能再认真揣摩一下叙述手法？为什么不能将主人公的潜在情感再挖掘细致点呢？你要么往高雅升华突破常规，要么往通俗里增加技巧煽情呀，为什么不上不下就缺了那么一口气…我能哭那是因为深深的身份认同感以及本身是个爱哭鬼。就，惋惜，惋惜得不行。或许又是被审查删改所限？单论动画效果我是给四星半的。
黑龙江,凄惨遭遇脑中幻化神奇旅程的范例不要太多，只是在这个版本里无论技术多炫丽，却始终无法与缺乏同理特质的故事弥合在一起。
黑龙江,"《千与千寻之参宿的奇幻漂流》

先说优点吧：
首先视效绝美，每一帧都能看出花了大钱
特效真是无可挑剔，用钱且用心
其次最后的两个场景很动人
属于煽情煽在了点子上
电影院里抽泣声一片

然而，缺点也同样明显
前期的画面真的太恶心了
克苏鲁风格的海精灵
混合着口水、臭脚和饭菜的场景
我这种毫无洁癖的人都难以容忍

人物方面，塑造的过于单薄
女主全程被推着走
突然就说不害怕也缺失心理过程

最后也是我觉得最严重的一点
就是虽然关注了抑郁症和抑郁症患者
但是传达的思想仍然是“要想开要高兴”
这并不是治疗抑郁症的方法
更不是人们应该对待抑郁症患者的方式

希望人们可以理解抑郁症需要干预与治疗
抑郁症不是心理疾病而是精神疾病
通过正规治疗，治愈率非常高
所以
别再对抑郁症患者说“高兴点”了"
安徽, 我完全没触动，就算看到最后也很疑惑，春节档三部电影我都这样，难道是我出问题了……但还是给真正想做好中国动画的导演们一个小小的建议。不要让剧本服务于画面和特效，不要开大切口，不要大面积浅耕。又看了其他的评论才意识到，导演想表达的抑郁症还是刻板印象层面的，有心理问题最重要的是好好治疗，而不是你自顾自地对人家说一切都会好的。林奕含形容抑郁症就像是失去了眼睛或双腿，是失去了快乐的能力。而导演通篇台词让她坚持，让她微笑。说明并没有真正研究过什么是抑郁症，除了增加大家的刻板印象之外毫无用处。
山东,缝合怪吧…一开始以为是千与千寻，又澡堂又鱼又饭店的。后来以为是周星驰讲不好笑的笑话，再等等以为是少年派的奇幻漂流，还有就是人是扫把星子的时候真共情不了，现在不兴爱蠢废物和没由来的英雄主义了。画面非常好，就是人物不讨喜。还有到底是谁教的玺帝台词法，已经超过出戏的范畴了，多跟大护法学学吧！
湖北,太尴尬了 尴尬到快结尾那段想要中途离场…… 好表面啊好刻意啊好做作啊，故事本来也没有很深，还非得把话说那么明白，就很…恶心诶……本来没多复杂的故事但很多地方人物动机又莫名其妙的。最可怕的是结尾前还强行带观众又重新看了遍电影复盘了一下，有没有搞错啊，生怕大家看不懂这么简单的故事呢，感觉智商被侮辱了。什么家庭问题啊抑郁症啊那些部分提都不想提，大叔+未成年少女的组合我也真的无语……绝美画面确实有，大概是有那么十分钟吧，但根本拉不回来这个拉胯剧情。那些优秀的画面真是被糟蹋了啊（咬牙切齿
内蒙古,画面太美了，无需多言，好的剧本更是锦上添花。精神疾病需要引起重视，抑郁症不是无病呻吟，希望你今后的每一次笑，都是发自内心的。
浙江,2.5 / 并未把新技术简单当作背景板，而是将其作为特殊材质与其他几种传统动画影像并立为不同的叙事空间。因此当人物撕裂内心的银幕时，推动力不是潦草的剧作，而是多种影像中的色彩挣脱再现形象并幻化为粒子的冲势；人物不断被撕扯的面容也不像是情绪的表达，更像是影像边界被扰动的标记。然而这个近乎《双子杀手》×《星之彩》的框架在全片来看并不怎么奏效，太多的时间浪费在俗套的奇幻冒险与干瘪的精神世界推演中，徒留虚张声势罢了。
浙江,《千与千寻》是一次邀请和探寻，而《深海》则是把人强行拽入异世界，倘若故事没有在最后得到翻转和揭示，那么它真的只是在用极度的绚烂换取极度的空洞。主段落“深海大饭店”几乎是纯炫技，因为角色的夸张和单薄，完全无法让我产生认同感，更不用说移情——《姜子牙》《杨戬》亦有此问题，国产动画的技术已经普遍性地压过了情节和人物。面对死亡这件事，《深海》的方式是举重若重，尽管有些用力过猛，但让那痛直抵人心。毫无疑问，春节档绝不是最优选。
上海,看不懂的希望你们永远都不要看懂
湖南,看得出来导演的执念很深 行至中途其实谜底已经全盘托出 但是不能因为画面偏向奇幻就存在明显不合理的时间线和故事线 幻想戏里缺乏一些基本的世界体系建设 海精灵 深海之眼究竟是什么 有什么来龙去脉 绝对不可以一笔带过 已经听到心跳归零的长鸣 最后的“欢迎姐姐回家”完全狗尾续貂不知所云
北京,兔年第一部院线！强烈推荐看IMAX3D版！！之前就听很多朋友推荐过深海的视效，看的时候就怀着高期待去的，依然超出了预期。不仅是技术层面的好，整个影片有非常完整的3D美学。剧情本身和视觉呈现相辅相成，用的是这几年很流行的叙事手法，在奇绝瑰丽的冒险景观背后，其实折射的都是主人公的心灵世界。南河其实就是南柯，从一开始就暗指南柯一梦。但这梦中的历险反而是对孤绝现实的缤纷救赎，其实也是被困于深度抑郁情绪的人的自救之旅。能在大屏幕上看到这样的题材、这样的呈现手法都非常惊喜
广东,就光色彩够我给五星！太绚丽了，和两个小学生一起看，她俩没哭，我一个三十几岁大人哭的一把鼻涕一把泪的……
上海,内核还是千与千寻那套，但比千与千寻差了至少4部玩具总动员。当下尽是追逐外感的刺激，正是这样的异化使得人迷失了爱而陷入深海。
海南,用汹涌搅动的颜料桶很真切生动地展现了抑郁症来袭和褪去时的感受，然而这个病要治愈，可不是靠别人给你一命抵一病啊，然后真正的病灶——那个冷漠的原生家庭——白拣了个现成，却并没有什么成长和改变，看完还挺气的诶……
广东,真棒！！为什么没有六颗星的选项？
重庆,我是国漫狂热份子，但是我无法共情，特效太满了，到了光污染的地步，就像用极致绚烂的色彩填满眼眶来掩盖其他地方的不足，人设跟大圣归来比基本没变化也没进步。不明白为什么主角五官乱飞，四肢乱弹。如果讲喜剧的内核是悲剧，中国奇谈的小猪妖很触动我。如果讲关于抑郁 人生低谷 救赎 重生，我想起一首日文歌，中岛美嘉的《曾经的我也想一了百了》，歌词描绘的场景也很触动我。如果讲绚烂的色彩描绘一个灰暗的故事《被嫌弃的松子》依然很触动我。但是我跟这个电影共情不了。
广东,"画面惊艳又有特色，可惜排片太少，只能在小厅看，如果能看imax或者激光厅啥的应该更好，另外3D效果也很棒，难得，
但是这个叙事是咋回事，超级聒噪，平庸，无聊，哪哪都是车轱辘话，这种普通不是个人审美上觉得普通，而是国产动画片大量的使用同类的叙述方式所造成的客观的普通，
比如，后半的通过反复大喊大叫来突破困局，你能在所有的封神和白蛇传动画里看到相同的桥段，
其实有这么优秀的画面，完全可以放弃叙事，哪怕简简单单的洗眼睛我都看得下去，现在这样，就像吃很美味的烤肉却一定要卷很难吃的生菜，非常难受"
河南,"憋了一个月，还是决定在春节档最后用这部收官。
即便早早听到看到了一些似是而非的评论，还是决定在没有任何提前了解剧情的情况下用本能去感受。
结果，前七八十分钟看得我也做好准备开怼了：什么剧本？！哪来的逻辑？！什么设计？！什么眼花缭乱的绘图上色？！什么乱七八糟啊？！！！
结果最后二十多分钟直接全部颠覆。所有先前的不解全部通透。
不仅仅是因为这是一部送给抑郁症患者的电影，不仅仅是一部送给成人未满的动画，不仅仅是因为将死亡和童话这样的元素搬上了大荧幕，不仅仅是中国动画有了更深刻的思考和呈现。
因为我也经历过妈妈离开过家，经历过自我了断的煎熬，经历过很多人的热潮冷讽，经历过噩梦中所有情景都在挣扎。
我懂。
我明白。"
江苏,煎熬啊，中年猥琐大叔和萝莉的互相治愈吗？情节呢？故事呢？你在讲神马啊～
四川,四星鼓励一下吧，这是一部需要耐心的片子，一部需要忍受孤独与无助的片子。或许是因为删减的原因，世界观的铺垫和人物的塑造都显得十分仓促，很多东西感觉是out of nowhere，叙事也因此变得磕绊和割裂，只有华美绝伦、华彩夺目的水墨粒子特效让观众保持期待——影片的最后半小时会让观众找到原谅这一切的理由，不必将它与《千与千寻》并提，因为世界观其实并不重要（我相信导演是想实现好的），这梦幻的底色是令人窒息的灰暗，斑斓的世界是受伤之后自我流放的乌托邦，故事的落脚点最终是被隐藏起来小女孩的限定视角，和她的心灵旅程，持续的、真心的爱与付出，终于让她愿意拥抱现实、相信世界会温柔以待。这锅鸡汤熬得不如《心灵奇旅》美味，但却比它更加深情，这深情会带来真心的感动，只是，需要些耐心。
江苏,前段男主角真的是令人生厌，全篇没有一个讨喜的角色，看得累且烦躁，可惜了这么绚烂的画面，讲了一个单薄俗套的故事。心情不好的时候独自看的晚场，看完心情更不好了。
