上海,现如今走入电影院就好比去了南河的大饭店，光怪陆离的创意菜是靠从过去无数的类型中拼凑出来的，可怜观众只想吃口正常饭，但在404层炸掉的电梯里，一次又一次地被掀翻。最后还是要靠榨出海精灵的汁，也就是特效和特技来对观众施以幻觉，才能换来五星好评。从这个意义上来说，我愿称深海为开年现实主义的作品………
广东,记得《小丑》有一条影评。无法代入剧情的人是幸福的。
重庆,在电影院睡到我的小米手环都开始记录了
江苏,剧本节奏很有问题，看得人昏昏欲睡。当片尾打出“醒醒，散场了”，显得格外讽刺。
江苏,建议田鹏导演把票房所得捐给心理健康慈善机构，作为他对心理工作者工作不尊重的道歉，诊断抑郁症请吃药，不是靠梦一场和爹味嘴炮^_^
广东,改编自母亲救女儿的故事却把母亲的角色整成丑男😅😅😅恶心谁呢
河南,特意选大年初一早间第一场，居然上座全满。国产动画的井喷年吗？开演前接连几部预告片，貌似都挺值得期待。《深海》稍嫌可惜，亮点缺点都十分明显，形成了口碑的两极。功能雷同的叙事段落不加克制的一再反复，消磨了绚丽视觉建立起来的惊艳感。收尾漂亮，重新挽回和收复了观众涣散的耐心。旁边座位的小姐姐一直在抹眼泪。“我才是丧气鬼！”“都是我的错！”“我不怕你！”——女孩嘶喊着，用尽浑身所有力气挣破封禁自己的那枚“茧”的一幕，相信会戳中每一位曾有抑郁经历的观者。我不知道一部影片是否足以提供治愈，但我愿意相信南河这一人物所象征或说隐喻的那种生命中救赎的力量终将出现。瑕不掩瑜，国产动画人加油啊！
上海,我有太多理由可以给它打五星，为挑不出半点毛病的美术，为同为精神疾病所困的强烈共情，为那句我等了30年的“这不是你的错”，为散场半小时还哭的停不下来的自己。中国是不是真的要文艺复兴了？
江苏,一星给美术。通过陌生人的生命去治愈自己的剧情，有一种世人皆你妈式的自以为是、蠢蛋式的英雄主义以及道德绑架式的自我感动。（而治愈的是抑郁症，就更显得制作团队真是脑瘫的别出心裁）
新西兰,粉墨画风不错，感情输出太廉价了。这故事和设定，呃，“千与千寻”和“少年派”双双表示有无语到，田晓鹏怎么就是不会打磨剧本呢...
河北,"把细节做繁，做的是1+1&lt;2的苦力活。这不是在突破审美观念，而是完全违背了审美规律。
"
广东,故事幼稚，台词老套，画面嘈杂，人物油腻，头晕。和闺蜜一起提前离场了。年纪大了，时间宝贵，不如喝茶聊天。
上海,所谓的海底最深处的深海之眼，不过就是内心最深处最痛的地方。不过就是落海濒死前的走马灯，大脑给自己幻想的一场美梦。从开头参宿逗弟弟笑，说明她不讨厌弟弟，而且也很配合懂事地努力融入新组成的家庭。爸爸不关心她，对她不上心，她难过，但仍然不闹，为了不破坏气氛，甚至强颜欢笑，懂事的让人心疼。就连在自己幻想中的“深海饭店”都是不论自己做什么都是错的，幻想中且如此，现实生活中她该有多难过，多痛苦呢？连结尾最后她醒过来病床边都没有人。幸好她遇到了南河，其实南河从某方面来说大抵是和她是一个群体，但南河依然坚强地生活着。南河最后和参宿说“希望你以后每一次的笑都是发自内心”。参宿最后破茧而出，是涅槃重生。说明她不再逃避，直面了内心最痛苦的地方，重获新生。结尾的彩蛋参宿又长大了，回头的那一笑是发自内心的。
海南,"有过抑郁情绪的人太能理解这片了，神作。
当然参宿如果也死了就更现实更神作了。"
江苏,洗衣服脏水乱倒映出五彩斑斓但又油腻的视觉泡沫。
北京,深海大饭店的画面让人生理不适，巨物、粘液、聒噪，预告片里却完全没有涉及这一部分，这不纯纯诈骗吗？
北京,画的好看，但不高级，故事也潦草拉垮。中国人除了吃饭和找妈真的没别的事儿吗？
浙江,影片的“人设”和“价值观”没有问题。影片真正想讲的是：一个不被世界在乎的弱小个体，如何与这个世界和解，并带着伤痛活下去。别说什么“抑郁症根本不是这样的”，这是电影，不是精神病学教材。何况：一个九岁孩子被母亲抛弃——平心而论，设身处地的想一下，自杀的理由“不够”么？
黑龙江,最近看到个说法，就是人类对刺激的阈值是越来越高的，但我还是觉得总有那么一撮儿人不知道哪儿来的自信用自以为高的阈值来评价剧本，《深海》的情感并不廉价，剧本写得也很高级，如果非要拿一套所谓的标准来评价，哪怕以罗伯特麦基为代表的那套好莱坞标准，《深海》的故事也不差；比起迪士尼很多剧本，《深海》出色脱俗得多，如果国内观众对这样一部电影还没什么接受度，觉得不似网文在类型里深耕，那我觉得问题不在《深海》，也就不必给这样的作品评价，希望我们也可以有这类电影可以生存的土壤，文艺作品应该、也需要这样搞
辽宁,"神作 我不懂为啥那么多人会喷这是部烂片
😭深海绝绝子 画面太美了 
是一部有门槛的影片 虽然前面较平淡但一定要全神贯注不能放过每一个镜头每一句台词 最后的结尾就会大彻大悟

"
湖北,看到最后30分钟听到旁边男生对同伴说“也不知道是电影有问题还是我有问题……”。很想接一句：“你没有问题”。
四川,"太恶心了这电影，几乎是我看过最烂的之一了，烂出天际，无聊还吵闹。。。最后还强行煽情就更恶心了不知道吃了几斤疙瘩汤能拍出这玩意儿"
辽宁,可以分开打分就好了，三分给动画技术本身，零分给到编剧和台词
广东,"一个人长得好看，会引人多看两眼。但深入了解后发现他无聊、丧气、任性、不合常理，好看也只是一戳就破的泡沫罢了。这部电影就是这样一个泡沫。绝美的美术搭配让人皱眉的人物行为和故事——相信导演也知道他的电影会让人昏睡，片尾打出了“醒醒吧，结束了”。不明白什么样的大力士小孩能徒手打开长满珊瑚海星的船舱顶盖（导演直接无视物理学，就是不愿放下对空洞美的执念）。也体会不到一个用iPhone的小孩到底能有多悲伤（我打了几年工才舍得买）。所有的父母都被描绘成肥肠油腻，正常身型都是正面角色。这种刻板印象出现在一部动画里简直是亵渎这门艺术。动画应是比真人作品对世界期待更高、审美和意识更开放，平视现实的艺术。动画有天然的优势去重构真实世界，解放观众的固化思维，而不是把现实的刻板印象程度加重，去歌颂苍白无力的美。"
江苏,2023年了，还在拍小女孩等待大叔拯救，随便一个故事就能治愈抑郁症……
北京,3.5 都不知道该谁背锅了，前面一个半小时视觉如此过剩，毫无主次轻重可言，动不动就打碎调色盘，一点气口不给留，完全就是在堆技术，最后真的疲惫到没啥力气了，又是这样重要的转折配上这么寡淡的视觉。头重脚轻摔了个大跟头，还得让观众坚持着跟您共情。观感可能因人而异吧，但有一点：我们所谓的“工业”到现在为止还是处在比较初级的“堆”人头阶段，跟其他工业一样都是劳动密集型，至于真正的创意部门其实远远没法提供完整性和原创性，更不知道该表达什么，甚或像某片一样直接走火入魔。这样的巨大失衡，真的离成熟形态还比较远。
河南,"本来还感觉惊喜，但参宿苏醒之后就落入俗套，如果电影停在参宿即将抓住南河的手就好了。
影片最后还用画面展示了参宿后来还算幸福的生活，可是我心里清楚，这个b生活根本不会有太大变化，爸爸、亲妈和后妈还是会对参宿漠不关心，参宿还是得不到她一直追寻的，来自妈妈的爱。
全片最惨——南河。"
广东,我愿称之为春节档最佳
陕西,大半夜哭成傻逼了，幸亏没在电影院看，要不吓着别人，完全是嚎啕大哭。有些电影就是这样，它会让你忘了那些评分标准，忍不住给满星。
湖南,全片给人一种说教式的“救赎”：跳了个海做了场梦，然后就走出抑郁症了，你看这不是很容易吗？
浙江,电影快结束的时候，坐着电影院的位置上，突然冒出一个念头，人生中能看到这样的电影，真是幸运啊
广西,从观众的角度来看，真的对荧幕上唯唯诺诺一言不发的女性形象有点疲惫了，真的就想看点爽的，直接掀桌的那种，哪怕所谓大女主也好，现实已经够隐忍了，疲于在一部动画里还要受气。后来又看到是以抑郁症为主题，更加心烦，拜托，没有天使会来拯救任何人，不是说笑一笑心情就会好的，不是说看到所谓的光明就是好的，本身人也能看到黑暗和光明，只是当黑暗来袭的时候什么光明感觉都变得无所谓了。其次从创作者的角度来看，不能因为讲述的是一个梦境的故事就这么胡说八道，剧情逻辑太混乱，所有所谓的伏笔到最后也不过仅仅是勉强的自圆其说，不过这一切的稀碎剧情终究比不过糟糕的人物行为逻辑烂，求求创作者能够想想人物的情绪动机吧，两个主角到底是从何而来的这么大的羁绊，你真的敢相信吗？最后，画面确实值得夸赞，但这造成了这个故事有如此大的割裂感
北京,没法共情，觉得有种对抑郁症的浅薄消费，特效好画面美是优点
吉林,一锅浓墨重彩花里胡哨实则是用廉价工业添加剂勾兑出来的黏糊糊的边角料大杂烩，还内含一坨主创自我感动甩下的鼻涕。主创或许是看着宫崎骏动画长大的，抄得手忙脚乱，但愣是没学会把小孩子尤其女孩子当成断了奶的独立个体，结果最后做出来的这锅东西唯一能映射出来的只有这群中年人自恋的油腻倒影。
福建,【C－】一声叹息。前四分之三基本全程挑战我的承受下限，其中所包含的具象克苏鲁元素恰恰是最不克苏鲁的部分，那些夸张、油腻且毫无节制的角色表演才是最不可名状的怪物（轻易超越《无名》），分镜、帧率和速率所共同组成的运动体系同样是致命的精神污染，在模仿真人影像的瑕疵中不断制造晦气的视觉垃圾，并吞噬自己仅剩的美术噱头。后四分之一的揭底基本拯救了全片（忽视前半段甚至可以给到四星），但矛盾点也无法忽视：这种好是通过反衬得来的，也可以通过解读将烂执行给轻易消解，但置于主题之上的“忧郁症”却是如此轻浮，再踏错一步就与「消费」无异。用腐烂的方法讲述正确的故事，观感也只剩矛盾与无奈，不禁令我怀念《雄狮少年》，至少它是扎实的、清晰的，甚至是克制的。
北京,都花那么多时间了，就不能再好好磨一磨剧本吗，前三分之二都让人冷漠脸。
甘肃,片子很好看，特效非常炫技，但是又败在了剧情上。拯救抑郁症的不是以命换命也不是以后要开心一点，而是科学的干预治疗，拍了这么多还是没有正视这个疾病。
广东,6.5/10。唯有叹息，如此强悍的技术力，同时具有完爆同题材作品的高概念设计，最后却只能呈现出如此糟糕的完成度。观影体验是痛苦的：一种毫无节制的视觉污染。而与失败的美学风格实验对应的却是单薄至极的剧情设计，第二幕那种夸张油腻的人物演出更是对主题的严重伤害。通篇也没有任何的留白空间，尤其是精神世界的符号对位，以至于最终前置于情感高潮的最大奇观，难以获得真正震撼人心的力量。至此最后一幕再怎么力挽狂澜也难扶大厦之将倾。
云南,"这部片没有典型反派以及清晰人物动机，可能很多人会觉得没逻辑，个人认为这片核心其实就是情绪。海精灵是对妈妈的执念，丧气鬼是自己的负面情绪，南河既是小丑南河也是参宿的自救意识，一整段的非现实和现实一一对应。
最后感动的是参宿放弃了在病床上听到的妈妈的声音，而转头奔向陌生人的真实善意，并接受了南河离去的事实，并不是南河拯救了参宿，而是她自己救了自己。
全片并没有讲太多的大道理，有在好好表达关怀身边人的情绪问题，尤其实在孩子成长阶段，情绪需求需要被看见被回应被安抚，希望趁过年能让一些看了的家长好好做父母。
最后，深海和大圣、吉卜力在叙事方式、凸现主题等本来就不是同类作品，不懂有些评价强行对比的意义。
"
北京,"《深海》又名《千与千寻》+《少年派的奇幻漂流》（潦草版）
前三分之二瑰丽、绚烂、空洞、美轮美奂，开场如炫彩夺目波澜壮阔的时空漩涡，把人吸入其中，来一场奇幻诡谲的深海冒险。
但人是会审美疲劳的，前期铺垫太久到八十分钟了还在炫技毫无节制，多少让人有些失望。当把你所有耐心都消磨殆尽时，后三分之一开始快速反转极致煽情，所有的一切急风骤雨般砸向你，参奏的痛苦、抑郁，直至放弃生命，南河的伟大、美好、救赎牺牲。你会为它感动落泪，但不是因影片的传达而共情，而是“我都煽成这样了，你还不给我哭！”
一直期待参宿会跟妈妈有个对话，结果什么都没有，还是一贯套路化的玩世不恭的英雄主义，看完只剩浅薄的感动，走出影院，风一吹就散了。"
辽宁,骗人的，世界上根本没有南河也没有深海大饭店。
黑龙江,这个b电影看的气死我了，预告片小海獭挺可爱的，结果进去了深海世界是加了大量克苏鲁元素的低配千与千寻。那个一坨密密麻麻头发丝里张一堆眼睛都海精灵是干嘛的？看着我就难受。深海饭店部分一点剧情没有，那个南河跟厨子有啥关系吧，客人一个个跟溜大了一样，完全不知道要表达个啥。加上光污染在影院真是折磨死我了。立意算是少见的关注一下重组家庭的孩子，但是你这是库库消费人家孩子和抑郁症啊，不解决女孩的困境问题，非要牺牲一个人去救赎一下子是吧？那能救赎的了吗？孩子自己跳的船，她不愧疚？死里逃生了她妈不还是不见她吗？孩子心结解开了吗？能不能关注一下重点？真恶心，看的我生气，气死我了。总结就是包装精美的依托答辩。特效确实挺好的，能不能用到正地方啊，讲一讲正常的故事吧。捏麻麻地，气死我了。
广东,"我能理解一些人认为小题大做无病呻吟，就像女孩的父亲；我能理解一些人能够共情感动，就像生活中受到过挫折、潜意识里总在自卑的大部分观众；我也能理解一些人备受伤害和煎熬，就像无数个真实生活里长期被原生家庭伤害的参宿，就像评论里认为受到冒犯的被迫受抑郁症等影响的观众。影片出现了多次的断层，但情绪渲染却火力全开，反复拉扯的主题让大家都只看到自己最注意的那一部分，无论的伤害还是治愈。
但必须说明：真实环境下的参宿需要相当大的心，才能将跳海救自己的南河的死转化为疗愈自己的动力。而电影因其特殊性，引导普通观众情绪和视角，让大家都普遍忽视了这一点。对于绝大部分的心理障碍患者来说，你无法用一个创伤去治愈另一个创伤。如果有，那叫洗脑。"
上海,没有思考的影片是爆米花电影，通篇都是思考却又思考得很浅薄的电影则令人惋惜。虽然部分画面炫丽得令人晃眼，但其画作技术与细腻程度几乎比肩国际水准，这点不可否认。田晓鹏在动画技术上专研琢磨，其用心可见一斑。只是这煞有介事的剧作不得不令人感到遗憾。本片的设定与宫崎骏的多部作品有着相似之处，但看宫崎骏的作品比如《千与千寻》，除了连贯的剧情，他亦有注入哲思，只是他的思考放在某个具体意象身上——无脸男。再看《幽灵公主》同样有着深刻的蕴意与道理、教育与呼吁。但却并不是通过口头一遍又一遍地申诉，而是寄托于意象——山神。抑郁症、原生家庭、儿童失爱……老生常谈的这么几个话题实在无需费全片篇幅去赘述，醉心于自我感动，忽略对人物的塑造。全片几乎全是性格单一的脸谱角色，动机与转变毫无铺垫。道理不要光靠喊，而应凝练透彻。
广东,完全没有感情投入！就像开着电脑看了两小时动态壁纸。
上海,确实不是一部放春节档的片子，因为内核是给成人看的救赎故事，不适合带娃看。不过确实相较于绚烂的画面，故事本身更令人触动，每个躲在自己保护壳下懂事无助的自己都希望有一个英雄站在身前施展魔法，愿每个走过长夜的人终将等到一束光。
江苏,哄小孩的玩意，適合8歲以下兒童。配音硬傷，賣慘可恥，畫面精美但劇情毫無感染力。成年人大過年看這個過於晦氣。
美国,导演可能是色弱吧…这不是五彩斑斓的美梦，这是光敏性癫痫人群的噩梦，我能想象会有很多人在电影院里只想闭上眼睛享受黑暗，
北京,以为是原生家庭的故事 结果是好人好事
北京,田晓鹏到底是什么大艺术家啊！这满屏幕的不合时宜的才华！
浙江,要不国产动画还是完蛋吧
湖北,😥诈骗啊，这段时间看了太多诈骗电影了，深海，谢谢你，诈骗犯。
北京,故事真的不是这么讲的。一个半小时的绚丽画面没有任何实质性的行动，最后半个小时的反转只是强作解释，真的看得没有任何波澜。
北京,说真的如果我害死一个陌生人可能抑郁会加重…  真心希望剧本不要这么想做抓马而是更加细致的描绘心灵的碰撞和一步步开放。而这样需要更多的笔触放在现实世界而不是梦境，所以剧本在合理性上感觉是失衡的。
安徽,【4】真诚是很可贵的，即便调动的一切并不超出预期，而有了技术力的加持，才真正成为一场盛宴。恍惚间甚至找到了当初看EVA时的震颤，在不同时代、不同语境下碇真嗣的出现，见证我们一戳就破的甜蜜。
重庆,不要再卷画面了，把剧情讲好吧，谁看电影是为了看美术啊？看电影的时候感觉我和我妹妹有代沟……
江西,又尬又低级  感觉评分都刷出来的
福建,感谢导演给晦暗的心织就这幅绮丽的美梦。有人说如果一部电影只有抑郁症患者可以共情，那不是失败的嘛？有没有一种可能，是我们被忽略得太久了，第一次被这样毫无保留地拽到阳光下感受别人习以为常的温暖。喜欢的电影可以有很多很多，但想要对导演说一声谢谢的，就是《深海》。谢谢你，看见我，洞穿我，代替我沙哑的嗓音引吭高歌。深海之中或许有惊涛骇浪，但太阳照进来也可以五彩斑斓。
上海,这画面风格和动画质量完全配得上讲一个更好的故事……
广东,难看得想跳海。剧情就是一坨浆糊，再添上一些自作聪明、有头无尾的感动片段，我完全不懂影片想表达什么。画面也许是精美，可真正有美感的片段不过片头以及片中丧气鬼爆发这两段，其他的都太满了，以至一片混沌；毫无克制的猎奇大特写毫无幽默感；造型以及场景设计完全是为了创意（一定要制造出点什么）而创意。观影全程在犯困、迷惑以及愤怒这三种状态当中切换。
甘肃,整个人哭成傻子。你一定想不到抑郁症患者的世界色彩太炫烂了。我们不要害怕。 心目中国产动画第一。
北京,在昨晚如坐针毡的看了三个小时的缝合怪之后，大早起没什么情绪的去电影博物馆看了深海，没想到电影结束走出影院还没办法醒过来，泪流不已。愿称这样的电影为中国电影工业的飞跃和骄傲。迷幻绮丽的视听艺术，中国风的水墨美学和技术突破，真正无国界的人文情感内核，故事和技术相得益彰，透过这部电影能看到导演和幕后团队柔软诚挚的真心。有时候我们是参宿，有时候我们也是南河。对我来说，南河是大圣，是田晓鹏，是周星驰，是治愈过我们的漫画和电影，是保卫我们精神家园的文学，是拯救过我们、在溺水时拉过我们一把的人和事。很幸运，我也拥有自己的南河。因为有ta，我的笑是真心的。祝贺中国动画有这样金子般的心的人才。希望这部不是特别适合春节档上映的电影能慢慢走出长尾，希望在国际市场上也能走的更广更远。
广东,前段时间确诊了重度抑郁，看这部电影前有些犹豫，但表妹想看，还是陪着看了。情节确实比较单薄，但是对于那种被“丧气鬼”追逐、缠绕乃至包裹的整个过程，画面和配乐的感染力太强了，太深有体会了，以至于在电影后期泪流不止，打湿了口罩。看完表妹问我“南河是不在了吗？这是个bad ending吗？”我说“不是所有故事都有happy ending”。希望自己能够早一点走出来，找回从前的自己。
广东,你们欠郭敬明PPT电影一个道歉
安徽,哭到口罩湿透。什么视效、剧情、抑郁症都不说了，就冲这个片子敢在大年初一上映，给五星。
辽宁,"观感：
1.华丽的刑具，在电影院里的俩小时仿佛在上刑。
2.从来不解决根本问题而是幻想着主角被陌生人“拯救”就能重获新生，编剧写剧本的能力永远比不上自我感动的能力，nb。
3.再也不想为国产电影花钱了。"
四川,简单的把抑郁症定义为灰色，向往生活中的彩色，彩色还是需要被人救赎才能获得，这是对抑郁症的侮辱，求求不要再输出这种肤浅价值观了。大过年恶心人真有你们的，本来视觉污染审美灾难已经让我很不适，没想到最后托底的能是她家人又对她好起来了，爬爬爬，垃圾，消费抑郁还要恶心抑郁，能存做个人！
安徽,让我想起来学生时期有段时间执着于论文字数顶格写，答题卡必须填满，PPT要做极精致漂亮诸如此类表面功夫的时候，至少不会被给差评，但言之无物食之无味，偶尔被评价为“努力”，离“聪明”尚且很远。
陕西,深海的情绪密度好浓。看电影前买了副3d眼镜，看完送给了检票员，拜托他赠人，他一脸诧异的盯着我。陌生人救了小女孩，为她编了一个童话。我从头哭到尾，不知道为什么我旁边的几个年轻人从头笑到尾，可能我也…我觉得这部电影，就像《四海》，去年《四海》我给了五星，我没把它当电影看，就像是《四海》藏在贺岁档，我笃定选了这部，以至于app提醒，这是您今年看的第一部电影，丧。还好，如我笃信的，丧即真实。可有的人沉溺其中，很痛苦，我是另外有的人，我靠写作。导演那句，散场啦，醒醒吧，让人绷不住。你看得出，这导演在这电影里藏了很多关于绘画，电影，想象的情怀。小女孩挣死往那个梦的世界里钻，我也想去……这么一部脑海中的作品展现于大荧幕，导演一定幸福，我感受的来，比《刺杀小说家》幸福多了啊。最后，敬想象，敬活着，也敬现实。
河南,已经准备好在电影院爆哭一顿的我…前面两个小时完全不信，所以后面用音乐音效节奏金句强行煽情的时候，只会觉得更加尴尬。剧情里看到了熟悉的影子，哈尔的移动城堡，千与千寻，少年派，毒液…画面那么漂亮，那么多人费了那么大劲，就讲了个这？最后，全体角色黏糊糊真的很不舒适…
广东,千言万语涌上心头，谢谢你愿意在东亚人追逐的集体主义和宏大叙事之下拥抱我们被禁锢的个体心中的幻梦世界🦋
黑龙江,好几年没去看院线的动画电影后，再去看本片后真是震惊于国内的动画水平已经高到这个水平了?除了画面外，我觉得这部片子最难得的是适合全年龄的观众去看，对于小朋友来说，这可能是个高配版的小蝌蚪找妈妈。可是对于成年人来说，片中出现的抑郁症、原生家庭和与世界和解的探讨，也是相当戳人的。其实没有想到田晓鹏会在《大圣归来》之后做了这样一部动画，意外也惊喜，他可以做观众想看的，但却做了属于自己的。
